{
  "blockers": [],
  "confidence": {
    "band": "High",
    "coverage": {
      "automated_and_expert_weight": 90,
      "independent_sources_weight": 100,
      "minimum_weight": 50
    },
    "disagreements": [],
    "reasons": [
      {
        "code": "independent_sources_with_observed",
        "text": "100 points of weight carry two or more source classes including observed or customer evidence (minimum 50)."
      }
    ]
  },
  "dimensions": [
    {
      "cap_applied": {
        "applied": false,
        "cap_fraction": 0.5,
        "points_capped_away": 0
      },
      "ceiling_points": 8,
      "components": {
        "automated_check": {
          "allowed": true,
          "checks_measured": 3,
          "checks_total": 3,
          "points_earned": 1.2,
          "points_possible": 1.2
        },
        "expert_assessment": {
          "ai_only": false,
          "allowed": true,
          "assessors_counted": 1,
          "points_earned": 2.8,
          "points_possible": 2.8,
          "points_withheld_ai_only": 0
        },
        "observed_or_customer": {
          "allowed": true,
          "metrics_measured": 2,
          "metrics_total": 2,
          "points_earned": 4,
          "points_possible": 4
        }
      },
      "evidence": [
        {
          "artifact_ref": "artifact/d1.copy_profile_language_lint.json",
          "check_id": "d1.copy_profile_language_lint",
          "disposition": "counted",
          "result": "pass",
          "source_class": "automated_check",
          "value": 1
        },
        {
          "artifact_ref": "artifact/d1.purpose_statement_present.json",
          "check_id": "d1.purpose_statement_present",
          "disposition": "counted",
          "result": "pass",
          "source_class": "automated_check",
          "value": 1
        },
        {
          "artifact_ref": "artifact/d1.product_md_consistency.json",
          "check_id": "d1.product_md_consistency",
          "disposition": "counted",
          "result": "pass",
          "source_class": "automated_check",
          "value": 1
        },
        {
          "artifact_ref": "artifact/emotional_clarity_positioning-human-reviewer.json",
          "assessor": "human-reviewer",
          "detail": "Fixture rationale for emotional_clarity_positioning.",
          "disposition": "counted",
          "result": "level_4",
          "source_class": "expert_assessment",
          "value": 1
        },
        {
          "artifact_ref": "artifact/first_screen_purpose_comprehension.json",
          "detail": "Fixture method: synthetic sessions.",
          "disposition": "counted",
          "metric_id": "first_screen_purpose_comprehension",
          "n": 12,
          "result": "measured",
          "source_class": "observed_behaviour",
          "value": 1
        },
        {
          "artifact_ref": "artifact/described_feeling_matches_intent.json",
          "detail": "Fixture method: synthetic sessions.",
          "disposition": "counted",
          "metric_id": "described_feeling_matches_intent",
          "n": 12,
          "result": "measured",
          "source_class": "customer_feedback",
          "value": 1
        }
      ],
      "floor": 0.5,
      "floor_attainment_percent": 100,
      "floor_met": true,
      "id": "emotional_clarity_positioning",
      "name": "Emotional clarity and positioning",
      "points_earned": 8,
      "points_not_measured": 0,
      "points_possible": 8,
      "status": "scored",
      "weight": 8
    },
    {
      "cap_applied": {
        "applied": false,
        "cap_fraction": 0.6,
        "points_capped_away": 0
      },
      "ceiling_points": 7,
      "components": {
        "automated_check": {
          "allowed": true,
          "checks_measured": 3,
          "checks_total": 3,
          "points_earned": 1.75,
          "points_possible": 1.75
        },
        "expert_assessment": {
          "ai_only": false,
          "allowed": true,
          "assessors_counted": 1,
          "points_earned": 2.45,
          "points_possible": 2.45,
          "points_withheld_ai_only": 0
        },
        "observed_or_customer": {
          "allowed": true,
          "metrics_measured": 2,
          "metrics_total": 2,
          "points_earned": 2.8,
          "points_possible": 2.8
        }
      },
      "evidence": [
        {
          "artifact_ref": "artifact/d2.impeccable_detect_findings.json",
          "check_id": "d2.impeccable_detect_findings",
          "disposition": "counted",
          "result": "pass",
          "source_class": "automated_check",
          "value": 1
        },
        {
          "artifact_ref": "artifact/d2.font_palette_deny_list.json",
          "check_id": "d2.font_palette_deny_list",
          "disposition": "counted",
          "result": "pass",
          "source_class": "automated_check",
          "value": 1
        },
        {
          "artifact_ref": "artifact/d2.token_uniqueness.json",
          "check_id": "d2.token_uniqueness",
          "disposition": "counted",
          "result": "pass",
          "source_class": "automated_check",
          "value": 1
        },
        {
          "artifact_ref": "artifact/brand_distinctiveness-human-reviewer.json",
          "assessor": "human-reviewer",
          "detail": "Fixture rationale for brand_distinctiveness.",
          "disposition": "counted",
          "result": "level_4",
          "source_class": "expert_assessment",
          "value": 1
        },
        {
          "artifact_ref": "artifact/unlabelled_screen_attribution.json",
          "detail": "Fixture method: synthetic sessions.",
          "disposition": "counted",
          "metric_id": "unlabelled_screen_attribution",
          "n": 12,
          "result": "measured",
          "source_class": "observed_behaviour",
          "value": 1
        },
        {
          "artifact_ref": "artifact/distinctiveness_rating.json",
          "detail": "Fixture method: synthetic sessions.",
          "disposition": "counted",
          "metric_id": "distinctiveness_rating",
          "n": 12,
          "result": "measured",
          "source_class": "customer_feedback",
          "value": 1
        }
      ],
      "floor": 0.5,
      "floor_attainment_percent": 100,
      "floor_met": true,
      "id": "brand_distinctiveness",
      "name": "Brand distinctiveness",
      "points_earned": 7,
      "points_not_measured": 0,
      "points_possible": 7,
      "status": "scored",
      "weight": 7
    },
    {
      "cap_applied": {
        "applied": false,
        "cap_fraction": 0.6,
        "points_capped_away": 0
      },
      "ceiling_points": 12,
      "components": {
        "automated_check": {
          "allowed": true,
          "checks_measured": 5,
          "checks_total": 5,
          "points_earned": 3.6,
          "points_possible": 3.6
        },
        "expert_assessment": {
          "ai_only": false,
          "allowed": true,
          "assessors_counted": 1,
          "points_earned": 3.6,
          "points_possible": 3.6,
          "points_withheld_ai_only": 0
        },
        "observed_or_customer": {
          "allowed": true,
          "metrics_measured": 3,
          "metrics_total": 3,
          "points_earned": 4.8,
          "points_possible": 4.8
        }
      },
      "evidence": [
        {
          "artifact_ref": "artifact/d3.nav_depth.json",
          "check_id": "d3.nav_depth",
          "disposition": "counted",
          "result": "pass",
          "source_class": "automated_check",
          "value": 1
        },
        {
          "artifact_ref": "artifact/d3.field_counts.json",
          "check_id": "d3.field_counts",
          "disposition": "counted",
          "result": "pass",
          "source_class": "automated_check",
          "value": 1
        },
        {
          "artifact_ref": "artifact/d3.heading_structure.json",
          "check_id": "d3.heading_structure",
          "disposition": "counted",
          "result": "pass",
          "source_class": "automated_check",
          "value": 1
        },
        {
          "artifact_ref": "artifact/d3.primary_action_per_screen.json",
          "check_id": "d3.primary_action_per_screen",
          "disposition": "counted",
          "result": "pass",
          "source_class": "automated_check",
          "value": 1
        },
        {
          "artifact_ref": "artifact/d3.task_flow_step_counts.json",
          "check_id": "d3.task_flow_step_counts",
          "disposition": "counted",
          "result": "pass",
          "source_class": "automated_check",
          "value": 1
        },
        {
          "artifact_ref": "artifact/usability_cognitive_load-human-reviewer.json",
          "assessor": "human-reviewer",
          "detail": "Fixture rationale for usability_cognitive_load.",
          "disposition": "counted",
          "result": "level_4",
          "source_class": "expert_assessment",
          "value": 1
        },
        {
          "artifact_ref": "artifact/task_completion_rate.json",
          "detail": "Fixture method: synthetic sessions.",
          "disposition": "counted",
          "metric_id": "task_completion_rate",
          "n": 12,
          "result": "measured",
          "source_class": "observed_behaviour",
          "value": 1
        },
        {
          "artifact_ref": "artifact/errors_per_task.json",
          "detail": "Fixture method: synthetic sessions.",
          "disposition": "counted",
          "metric_id": "errors_per_task",
          "n": 12,
          "result": "measured",
          "source_class": "observed_behaviour",
          "value": 1
        },
        {
          "artifact_ref": "artifact/ease_rating.json",
          "detail": "Fixture method: synthetic sessions.",
          "disposition": "counted",
          "metric_id": "ease_rating",
          "n": 12,
          "result": "measured",